<devices xmlns:xsi="http://www.w3.org/2001/XMLSchema-instance"
         xmlns="http://www.vlad.by/devices/test"
         xsi:schemaLocation="http://www.vlad.by/devices/test devicesSchemaTest.xsd">

    <cpu-device id="index-23">
        <name>Intel Core i5-5200U</name>
        <origin>USA</origin>
        <price>600.0</price>
        <type>
            <device-type>not a peripheral</device-type>
            <power-usage>15</power-usage
            <presence-of-cooler>false</presence-of-cooler>
            <device-group>processors</device-group>
            <port>NONE</port>
        </type>
        <release-date>2015-02</release-date
        <core-architecture>Broadwell</core-architecture>
        <frequency>2.2</frequency>
        <core-count>2</core-count>
        <thread-count>4</thread-count>
        <cache-size>3</cache-size>
    </cpu-device>

    <gpu-device id="index-43">
        <name>GeForce GTX 780 Ti</name>
        <origin>USA</origin>
        <price>500.0</price>
        <type>
            <device-type>not a peripheral</device-type>
            <power-usage>250</power-usage>
            <presence-of-cooler>true</presence-of-cooler>
            <device-group>processors</device-group>
            <port>VGA</port>
        </type>
        <release-date>2013-11</release-date>
        <architecture>Kepler</architecture>
        <memory-type>GDDR5</memory-type>
        <memory-size>3</memory-size>
    </gpu-device>
</devices>